{
  "nome_exame": "ZDC BioManguinhos",
  "slug": "zdcbm",
  "equipamento": "7500 Real-Time",
  "tipo_placa_analitica": "96",
  "esquema_agrupamento": "96->32",
  "kit_codigo": 1832,
  "alvos": [
    "ZK",
    "CHIK",
    "DEN1",
    "DEN2",
    "DEN3",
    "DEN4",
    "RP"
  ],
  "mapa_alvos": {
    "ZK": "ZK",
    "Zika": "ZK",
    "ZYK": "ZK",
    "CHIK": "CHIK",
    "Chikungunya": "CHIK",
    "CHIKUNGUNYA": "CHIK",
    "DEN1": "DEN1",
    "D1": "DEN1",
    "Dengue1": "DEN1",
    "DENGUE1": "DEN1",
    "DEN2": "DEN2",
    "D2": "DEN2",
    "Dengue2": "DEN2",
    "DENGUE2": "DEN2",
    "DEN3": "DEN3",
    "D3": "DEN3",
    "Dengue3": "DEN3",
    "DENGUE3": "DEN3",
    "DEN4": "DEN4",
    "D4": "DEN4",
    "Dengue4": "DEN4",
    "DENGUE4": "DEN4",
    "RP": "RP"
  },
  "faixas_ct": {
    "detect_max": 40.0,
    "inconc_min": 38.1,
    "inconc_max": 40.0,
    "rp_min": 8.1,
    "rp_max": 35.0
  },
  "rps": [
    "RP"
  ],
  "export_fields": [
    "Dengue1",
    "Dengue2",
    "Dengue3",
    "Dengue4",
    "Zika",
    "Chikungunya"
  ],
  "panel_tests_id": "zdcbm",
  "controles": {
    "cn": [],
    "cp": [
      "RP"
    ]
  },
  "comentarios": "Cadastro canônico ZDC BioManguinhos (3 poços, 96->32)",
  "versao_protocolo": "1",
  "pocos_por_amostra": 3,
  "targets_por_poco": [
    {"alvo": "ZK", "filtro": "VIC", "poco": 1, "tipo": "VIRAL"},
    {"alvo": "CHIK", "filtro": "FAM", "poco": 1, "tipo": "VIRAL"},
    {"alvo": "RP", "filtro": "NED", "poco": 1, "tipo": "RP"},
    {"alvo": "DEN1", "filtro": "FAM", "poco": 2, "tipo": "VIRAL"},
    {"alvo": "DEN2", "filtro": "ROX", "poco": 2, "tipo": "VIRAL"},
    {"alvo": "RP", "filtro": "NED", "poco": 2, "tipo": "RP"},
    {"alvo": "DEN3", "filtro": "FAM", "poco": 3, "tipo": "VIRAL"},
    {"alvo": "DEN4", "filtro": "ROX", "poco": 3, "tipo": "VIRAL"},
    {"alvo": "RP", "filtro": "NED", "poco": 3, "tipo": "RP"}
  ],
  "limiares_ct_por_alvo_poco": [
    {"alvo": "ZK", "poco": 1, "ct_minimo": 8.1, "ct_detectavel_limite": 38.1, "ct_inconclusivo_limite": 40.0},
    {"alvo": "CHIK", "poco": 1, "ct_minimo": 8.1, "ct_detectavel_limite": 40.1, "ct_inconclusivo_limite": 40.1},
    {"alvo": "RP", "poco": 1, "ct_minimo": 8.1, "ct_detectavel_limite": 35.0, "ct_inconclusivo_limite": 35.0},
    {"alvo": "DEN1", "poco": 2, "ct_minimo": 8.1, "ct_detectavel_limite": 40.1, "ct_inconclusivo_limite": 40.1},
    {"alvo": "DEN2", "poco": 2, "ct_minimo": 8.1, "ct_detectavel_limite": 40.1, "ct_inconclusivo_limite": 40.1},
    {"alvo": "RP", "poco": 2, "ct_minimo": 8.1, "ct_detectavel_limite": 35.0, "ct_inconclusivo_limite": 35.0},
    {"alvo": "DEN3", "poco": 3, "ct_minimo": 8.1, "ct_detectavel_limite": 40.1, "ct_inconclusivo_limite": 40.1},
    {"alvo": "DEN4", "poco": 3, "ct_minimo": 8.1, "ct_detectavel_limite": 40.1, "ct_inconclusivo_limite": 40.1},
    {"alvo": "RP", "poco": 3, "ct_minimo": 8.1, "ct_detectavel_limite": 35.0, "ct_inconclusivo_limite": 35.0}
  ]
}
